{
  "$schema": "./_schema.json",
  "id": "openai",
  "displayName": "OpenAI",
  "baseUrl": "https://api.openai.com/v1",
  "apiKeyUrl": "https://platform.openai.com/api-keys",
  "protocol": "openai",
  "defaultModel": "gpt-5.5",
  "subAgentModel": "gpt-5.4",
  "quirks": {
    "streamOptions": true,
    "parallelTools": true,
    "useMaxCompletionTokens": true
  },
  "models": [
    {
      "id": "gpt-5.5",
      "displayName": "GPT-5.5",
      "contextWindow": 1050000,
      "maxOutputTokens": 128000,
      "capabilities": { "tools": true, "reasoning": true, "vision": true }
    },
    {
      "id": "gpt-5.4",
      "displayName": "GPT-5.4",
      "contextWindow": 1050000,
      "maxOutputTokens": 128000,
      "capabilities": { "tools": true, "reasoning": true, "vision": true }
    },
    {
      "id": "gpt-4o",
      "displayName": "GPT-4o",
      "contextWindow": 128000,
      "maxOutputTokens": 16384,
      "capabilities": { "tools": true, "reasoning": false, "vision": true },
      "quirks": {
        "useMaxCompletionTokens": false
      }
    }
  ]
}
