{
  "$schema": "./_schema.json",
  "id": "deepseek",
  "displayName": "DeepSeek",
  "baseUrl": "https://api.deepseek.com",
  "apiKeyUrl": "https://platform.deepseek.com/api_keys",
  "protocol": "openai",
  "defaultModel": "deepseek-v4-pro",
  "subAgentModel": "deepseek-v4-flash",
  "quirks": {
    "streamOptions": true,
    "parallelTools": true,
    "useMaxCompletionTokens": false,
    "balanceEndpoint": "/user/balance",
    "reasoningField": "reasoning_content",
    "stripInputFields": ["reasoning_content"]
  },
  "models": [
    {
      "id": "deepseek-v4-pro",
      "displayName": "DeepSeek V4 Pro",
      "contextWindow": 1000000,
      "maxOutputTokens": 384000,
      "capabilities": { "tools": true, "reasoning": true, "vision": false },
      "pricing": {
        "currency": "CNY",
        "input": 12.0,
        "cache_hit": 0.1,
        "output": 24.0,
        "discount": {
          "label": "2.5折",
          "until": "2099-12-31T15:59:00Z",
          "input": 3.0,
          "cache_hit": 0.025,
          "output": 6.0
        }
      }
    },
    {
      "id": "deepseek-v4-flash",
      "displayName": "DeepSeek V4 Flash",
      "contextWindow": 1000000,
      "maxOutputTokens": 384000,
      "capabilities": { "tools": true, "reasoning": true, "vision": false },
      "pricing": {
        "currency": "CNY",
        "input": 1.0,
        "cache_hit": 0.02,
        "output": 2.0
      }
    }
  ]
}
